{
  "slug": "teatro-almazen",
  "type": "company",
  "name": "Teatro AlmaZen",
  "legal_name": null,
  "description_md": null,
  "commune": "concon",
  "other_communes": [
    "quillota"
  ],
  "disciplines": [
    "teatro-familiar"
  ],
  "audiences": [],
  "founded_year": null,
  "status": "desconocido",
  "last_activity_at": null,
  "members": [],
  "members_text": [],
  "works": [],
  "venues": [],
  "place": null,
  "email": null,
  "contact_authorized": false,
  "website": null,
  "social": {
    "instagram": null,
    "facebook": null,
    "tiktok": null,
    "youtube": null
  },
  "trajectory_md": null,
  "recognitions": [],
  "funding_awards": [],
  "festivals": [
    {
      "festival_name": "Ciclo de Teatro Familiar de Quillota",
      "year": 2019,
      "place": "Quillota",
      "source_index": null
    }
  ],
  "media": [],
  "media_candidates": [],
  "series": [],
  "tags": [],
  "sources": [
    {
      "url": "https://chilecultura.gob.cl/events/3197/",
      "title": "Ciclo de Teatro Familiar de Quillota",
      "publisher": "Chile Cultura — Ministerio de las Culturas, las Artes y el Patrimonio",
      "type": "institucional",
      "level": 1,
      "role": "primaria",
      "accessed_at": "2026-09-08",
      "archived_url": null,
      "supports": [],
      "notes": "Ficha de evento de 2019: cuatro obras en tres días (18, 19 y 20 de julio de 2019), $2.000, Centro Cultural Leopoldo Silva Reynoard, Avenida 21 de Mayo 200, Quillota. La ficha no asigna cada obra a un día."
    }
  ],
  "verification": {
    "status": "pendiente",
    "confidence_score": 60,
    "verified_at": null,
    "verified_by": null,
    "next_review_at": null,
    "note": "Importado del catastro regional del ecosistema teatral (Fase 1: descubrimiento); pendiente de verificación editorial."
  },
  "published": false
}
