{
  "slug": "centro-cultural-y-colectivo-teatral-la-mandragora",
  "type": "company",
  "name": "Centro Cultural y Colectivo Teatral La Mandrágora",
  "legal_name": null,
  "description_md": null,
  "commune": "vina-del-mar",
  "other_communes": [],
  "disciplines": [
    "teatro"
  ],
  "audiences": [],
  "founded_year": null,
  "status": "desconocido",
  "last_activity_at": null,
  "members": [],
  "members_text": [],
  "works": [],
  "venues": [],
  "place": null,
  "email": null,
  "contact_authorized": false,
  "website": null,
  "social": {
    "instagram": null,
    "facebook": null,
    "tiktok": null,
    "youtube": null
  },
  "trajectory_md": null,
  "recognitions": [],
  "funding_awards": [],
  "festivals": [],
  "media": [],
  "media_candidates": [],
  "series": [],
  "tags": [],
  "sources": [
    {
      "url": "https://puntos.cultura.gob.cl/valparaiso/",
      "title": "Puntos de Cultura Validados Región de Valparaíso",
      "publisher": "Ministerio de las Culturas, las Artes y el Patrimonio — Programa Puntos de Cultura Comunitaria",
      "type": "institucional",
      "level": 1,
      "role": "primaria",
      "accessed_at": "2026-09-08",
      "archived_url": null,
      "supports": [],
      "notes": "Listado de 87 organizaciones por comuna. La página no describe el ámbito de la mayoría; solo el nombre permite inferirlo, por lo que los ámbitos quedan como 'por confirmar' salvo que el nombre lo diga."
    }
  ],
  "verification": {
    "status": "pendiente",
    "confidence_score": 35,
    "verified_at": null,
    "verified_by": null,
    "next_review_at": null,
    "note": "Importado del catastro regional del ecosistema teatral (Fase 1: descubrimiento); pendiente de verificación editorial."
  },
  "published": false
}
