{
  "slug": "flamenco-triana",
  "type": "company",
  "name": "Flamenco Triana",
  "legal_name": "Centro Cultural de Arte Español Flamenco Triana",
  "description_md": null,
  "commune": "vina-del-mar",
  "other_communes": [],
  "disciplines": [
    "danza"
  ],
  "audiences": [],
  "founded_year": null,
  "status": "desconocido",
  "last_activity_at": null,
  "members": [],
  "members_text": [],
  "works": [],
  "venues": [],
  "place": null,
  "email": null,
  "contact_authorized": false,
  "website": null,
  "social": {
    "instagram": null,
    "facebook": null,
    "tiktok": null,
    "youtube": null
  },
  "trajectory_md": null,
  "recognitions": [],
  "funding_awards": [],
  "festivals": [],
  "media": [],
  "media_candidates": [],
  "series": [],
  "tags": [],
  "sources": [
    {
      "url": "https://www.fondosdecultura.cl/wp-content/uploads/2025/01/SELECCIONADOS-FAAEE-2025.pdf",
      "title": "Nóminas de seleccionados Fondo de Artes Escénicas 2025 (líneas notificadas en enero 2025)",
      "publisher": "Ministerio de las Culturas, las Artes y el Patrimonio — Fondos Cultura",
      "type": "institucional",
      "level": 1,
      "role": "primaria",
      "accessed_at": "2026-09-08",
      "archived_url": null,
      "supports": [],
      "notes": null
    },
    {
      "url": "https://www.fondosdecultura.cl/wp-content/uploads/2024/06/NominaSeleccionados-Paocc_teatro.pdf",
      "title": "Nómina de seleccionados Convocatoria Compañías de trayectoria de artes escénicas (PAOCC) 2024",
      "publisher": "Ministerio de las Culturas, las Artes y el Patrimonio — Fondos Cultura",
      "type": "institucional",
      "level": 1,
      "role": "secundaria",
      "accessed_at": "2026-09-08",
      "archived_url": null,
      "supports": [],
      "notes": null
    },
    {
      "url": "https://www.fondosdecultura.cl/wp-content/uploads/2022/06/SELECCIONADOS-FAAEE22-CIRCULACION_INTERv2.pdf",
      "title": "Seleccionados Circulación Internacional de Artes Escénicas 2022",
      "publisher": "Ministerio de las Culturas, las Artes y el Patrimonio — Fondos Cultura",
      "type": "institucional",
      "level": 1,
      "role": "secundaria",
      "accessed_at": "2026-09-08",
      "archived_url": null,
      "supports": [],
      "notes": null
    },
    {
      "url": "https://www.munivina.cl/noticias/teatro-municipal-de-vina-del-mar-inicia-el-2026-con-espectaculares-conciertos-teatro-danza-y-humor/",
      "title": "Teatro Municipal de Viña del Mar inicia el 2026 con espectaculares conciertos, teatro, danza y humor",
      "publisher": "Ilustre Municipalidad de Viña del Mar",
      "type": "institucional",
      "level": 1,
      "role": "secundaria",
      "accessed_at": "2026-09-08",
      "archived_url": null,
      "supports": [],
      "notes": "Nota del 9 de enero de 2026."
    }
  ],
  "verification": {
    "status": "pendiente",
    "confidence_score": 60,
    "verified_at": null,
    "verified_by": null,
    "next_review_at": null,
    "note": "Importado del catastro regional del ecosistema teatral (Fase 1: descubrimiento); pendiente de verificación editorial."
  },
  "published": false
}
