{
  "slug": "taller-municipal-de-teatro-de-quillota",
  "type": "company",
  "name": "Taller Municipal de Teatro de Quillota",
  "legal_name": null,
  "description_md": null,
  "commune": "quillota",
  "other_communes": [],
  "disciplines": [
    "teatro-comunitario"
  ],
  "audiences": [],
  "founded_year": null,
  "status": "desconocido",
  "last_activity_at": null,
  "members": [],
  "members_text": [],
  "works": [],
  "venues": [],
  "place": null,
  "email": null,
  "contact_authorized": false,
  "website": null,
  "social": {
    "instagram": null,
    "facebook": null,
    "tiktok": null,
    "youtube": null
  },
  "trajectory_md": null,
  "recognitions": [],
  "funding_awards": [],
  "festivals": [],
  "media": [],
  "media_candidates": [],
  "series": [],
  "tags": [],
  "sources": [
    {
      "url": "https://quillota.cl/municipalidad/wp-content/uploads/2025/08/Quillota-Cultural-JULIO_-2025.pdf",
      "title": "Quillota Cultural — julio 2025 (publicación digital mensual de la Dirección de Cultura)",
      "publisher": "Ilustre Municipalidad de Quillota — Dirección de Cultura",
      "type": "institucional",
      "level": 1,
      "role": "primaria",
      "accessed_at": "2026-09-08",
      "archived_url": null,
      "supports": [],
      "notes": "Boletín de 112 páginas leído con PyMuPDF. Contiene estreno de 'El motín contra Portales' (12 de julio de 2025), actividades del Taller Municipal de Teatro, 'Tibia' y el XXI Festival Nacional de Danza de Los Andes."
    },
    {
      "url": "https://quillota.cl/municipalidad/wp-content/uploads/2025/10/Quillota-Cultural-septiembre_-2025.pdf",
      "title": "Quillota Cultural — septiembre 2025 (publicación digital mensual de la Dirección de Cultura)",
      "publisher": "Ilustre Municipalidad de Quillota — Dirección de Cultura",
      "type": "institucional",
      "level": 1,
      "role": "secundaria",
      "accessed_at": "2026-09-08",
      "archived_url": null,
      "supports": [],
      "notes": "Boletín de 105 páginas leído con PyMuPDF. Seminario de voz del Taller Municipal de Teatro (Pablo Valencia), salida pedagógica al Teatro Municipal de Viña del Mar ('El Húsar de la Muerte', La Patogallina, 30 de septiembre de 2025)."
    }
  ],
  "verification": {
    "status": "pendiente",
    "confidence_score": 60,
    "verified_at": null,
    "verified_by": null,
    "next_review_at": null,
    "note": "Importado del catastro regional del ecosistema teatral (Fase 1: descubrimiento); pendiente de verificación editorial."
  },
  "published": false
}
