{
  "slug": "nina-titeres-y-cuentacuentos",
  "type": "company",
  "name": "Nina Títeres y Cuentacuentos",
  "legal_name": null,
  "description_md": "Proyecto de Nina Legrand ('Ninatitiricuenta'), titiritera, cuentacuentos y arteterapeuta comunitaria con más de 20 años de trayectoria en el Valle del Aconcagua: títeres tipo muppet, teatro de objetos, máscaras y lambe lambe; talleres y mediación lectora en escuelas y comunidades (fomento lector, educación emocional, medio ambiente, identidad local).",
  "commune": "san-felipe",
  "other_communes": [],
  "disciplines": [
    "titeres",
    "narracion-oral",
    "lambe-lambe"
  ],
  "audiences": [],
  "founded_year": null,
  "status": "desconocido",
  "last_activity_at": null,
  "members": [],
  "members_text": [],
  "works": [],
  "venues": [],
  "place": null,
  "email": null,
  "contact_authorized": false,
  "website": null,
  "social": {
    "instagram": null,
    "facebook": null,
    "tiktok": null,
    "youtube": null
  },
  "trajectory_md": null,
  "recognitions": [],
  "funding_awards": [],
  "festivals": [
    {
      "festival_name": "Festival Ventolera",
      "year": 2024,
      "place": "Valparaíso",
      "source_index": null
    }
  ],
  "media": [],
  "media_candidates": [],
  "series": [],
  "tags": [],
  "sources": [
    {
      "url": "https://www.cultura.gob.cl/agendacultural/valparaiso-festival-ventolera-celebrara-a-titiriteros-y-marionetistas-de-la-region/",
      "title": "Valparaíso: Festival Ventolera celebrará a titiriteros y marionetistas de la región",
      "publisher": "Ministerio de las Culturas, las Artes y el Patrimonio",
      "type": "institucional",
      "level": 1,
      "role": "primaria",
      "accessed_at": "2026-09-05",
      "archived_url": null,
      "supports": [],
      "notes": "Confirma organizador (Asamblea Titiritera ATTICH V con Seremi de las Culturas), fecha, sede y taller con Giovanni Vaccaro."
    },
    {
      "url": "https://eltrabajo.cl/web/dia-mundial-del-titere-cultores-del-valle-destacan-importancia-de-este-arte-en-la-comunidad/",
      "title": "Día Mundial del Títere: Cultores del valle destacan importancia de este arte en la comunidad",
      "publisher": "Diario El Trabajo (San Felipe)",
      "type": "prensa",
      "level": 2,
      "role": "secundaria",
      "accessed_at": "2026-09-08",
      "archived_url": null,
      "supports": [],
      "notes": "Nota del 22 de marzo de 2026 con perfiles de Nina Legrand (San Felipe) y Hugo Hernández Urtubia (Los Andes)."
    }
  ],
  "verification": {
    "status": "pendiente",
    "confidence_score": 60,
    "verified_at": null,
    "verified_by": null,
    "next_review_at": null,
    "note": "Importado del catastro regional del ecosistema teatral (Fase 1: descubrimiento); pendiente de verificación editorial."
  },
  "published": false
}
