{
  "slug": "cooperativa-corredor-danza-valparaiso",
  "type": "company",
  "name": "Cooperativa Corredor Danza Valparaíso",
  "legal_name": "Cooperativa Corredor Danza Valparaíso Ltda.",
  "description_md": null,
  "commune": "valparaiso",
  "other_communes": [],
  "disciplines": [
    "danza"
  ],
  "audiences": [],
  "founded_year": null,
  "status": "desconocido",
  "last_activity_at": null,
  "members": [],
  "members_text": [],
  "works": [],
  "venues": [],
  "place": null,
  "email": null,
  "contact_authorized": false,
  "website": null,
  "social": {
    "instagram": null,
    "facebook": null,
    "tiktok": null,
    "youtube": null
  },
  "trajectory_md": null,
  "recognitions": [],
  "funding_awards": [
    {
      "fund_name": "Entremos en Movimiento Programa de Corredor Danza Valparíso para la formación y sensibilización de públicos en danza contemporánea",
      "org": "Fondo de Artes Escénicas",
      "year": 2026,
      "folio": "826772",
      "amount_clp": 6985897,
      "url": null,
      "note": null,
      "source_index": null
    }
  ],
  "festivals": [],
  "media": [],
  "media_candidates": [],
  "series": [],
  "tags": [],
  "sources": [
    {
      "url": "https://www.fondosdecultura.cl/wp-content/uploads/2026/01/seleccionados-aaee-2026-enero.pdf",
      "title": "Nóminas de seleccionados Fondo de Artes Escénicas 2026 (líneas Creación Escénica, Montajes, Circulación Nacional, Difusión Digital, Equipamiento, Investigación, Programas Formativos)",
      "publisher": "Ministerio de las Culturas, las Artes y el Patrimonio — Fondos Cultura",
      "type": "institucional",
      "level": 1,
      "role": "primaria",
      "accessed_at": "2026-09-08",
      "archived_url": null,
      "supports": [],
      "notes": null
    },
    {
      "url": "https://www.fondosdecultura.cl/wp-content/uploads/2022/01/SELECCIONADOS-FAAEE-2022.pdf",
      "title": "Seleccionados Fondo de Artes Escénicas 2022",
      "publisher": "Ministerio de las Culturas, las Artes y el Patrimonio — Fondos Cultura",
      "type": "institucional",
      "level": 1,
      "role": "secundaria",
      "accessed_at": "2026-09-08",
      "archived_url": null,
      "supports": [],
      "notes": null
    },
    {
      "url": "https://www.fondosdecultura.cl/wp-content/uploads/2024/02/SELECCIONADOS-LINEA-DE-ASISTENCIA-A-INSTANCIAS-INTERNACIONALES.pdf",
      "title": "Seleccionados Línea Asistencia a Instancias Internacionales en Artes Escénicas 2024",
      "publisher": "Ministerio de las Culturas, las Artes y el Patrimonio — Fondos Cultura",
      "type": "institucional",
      "level": 1,
      "role": "secundaria",
      "accessed_at": "2026-09-08",
      "archived_url": null,
      "supports": [],
      "notes": null
    },
    {
      "url": "https://www.fondosdecultura.cl/wp-content/uploads/2023/05/Seleccionados-2dollamado-Circulacion-inter-AAEE2023-1.pdf",
      "title": "Seleccionados Circulación Internacional de Artes Escénicas 2023 (segundo llamado)",
      "publisher": "Ministerio de las Culturas, las Artes y el Patrimonio — Fondos Cultura",
      "type": "institucional",
      "level": 1,
      "role": "secundaria",
      "accessed_at": "2026-09-08",
      "archived_url": null,
      "supports": [],
      "notes": null
    }
  ],
  "verification": {
    "status": "pendiente",
    "confidence_score": 35,
    "verified_at": null,
    "verified_by": null,
    "next_review_at": null,
    "note": "Importado del catastro regional del ecosistema teatral (Fase 1: descubrimiento); pendiente de verificación editorial."
  },
  "published": false
}
